"id","url","publication_title","description","status","g_status","title","status_writer"
27292,"https://www.britishnewspaperarchive.co.uk/viewer/download/bl/0001097/18470817/011/0002","South Eastern Gazette","... Bouvcrie. Election Riot. Man Killed by the Police On Saturday an adjourned inquest was held Sleaford, before Mr. G. Kewney, coroner, on the body of Wm. Dyson. It appeared from the evidence, which was exceedingly voluminous, that the election of Lord Burghley ...",1,"2","ROCHESTER AND CHATHAM RACES","xgboost_description"
27376,"https://www.britishnewspaperarchive.co.uk/viewer/download/bl/0000359/18470812/036/0003","Wiltshire Independent","... ELECTION INTELLIGENCE. Western Division of Gloucestershire. The nomination for this division of the county of Gloucester took place Dnrsley, yesterday week. Mr. Aaron Goold, of Dean forest, proposed Hon. Grantley Berkeley ; the motion was seconded by ...",1,"7","ELECTION INTELLIGENCE","xgboost_description"
27384,"https://www.britishnewspaperarchive.co.uk/viewer/download/bl/0000183/18470813/012/0002","London Evening Standard","... least 20 per cent. This diminution cannot be explained by the season of the year, for the general election of 1837, like the present gene- ral election, was held in the summer recess. There is but one solution of the seeming paradox, namely, that one ...",1,"7","The conclusion of the election for the metro- politan county deserves a special notice, not only in ..","xgboost_description"
27395,"https://www.britishnewspaperarchive.co.uk/viewer/download/bl/0000156/18470811/031/0004","Bury and Norwich Post","... GENERAL ELECTION. EAST BUPFOLK ELECTION. The election of Member, to repreaeat the Dirwon East Suffolk in the next Pirliiment, took place Ipewieh Thursday ait. The frien.li and upporten Lord and Edward Sherlock Eeq., met them at the Heatone the Woodbridge ...",1,"2","GENERAL ELECTION","xgboost_description"
27413,"https://www.britishnewspaperarchive.co.uk/viewer/download/bl/0001300/18470731/065/0005","Liverpool Mail","... electors. There being no other candidate proposed, the mayor declared Mr. Wilson duly elected. MANCHESTER ELECTION. On Thursday morning the nomination and election for Manchester took place. The hustings were erected in St. Annes-square, capable of holding ...",1,"2","ELECTION PROCEEDINGS","xgboost_description"
27415,"https://www.britishnewspaperarchive.co.uk/viewer/download/bl/0000874/18470807/013/0003","Weekly Vindicator","... IRISH ELECTIONS. Coleraixe The tenant-right candidate. Dr. Royd. has been returned by a majority of 56, Sir Hervey Bruce having withdrawn from the contest. Uowspatrick. On Wednesday, Richard Ker, Esqbeing proposed by John Hastings, Esq., and seconded ...",1,"7","IRISH ELECTIONS","xgboost_description"
27420,"https://www.britishnewspaperarchive.co.uk/viewer/download/bl/0001955/18470803/031/0004","Wilts and Gloucestershire Standard","... declared the election to have fallen open Mr. Ninth and Sir. Brown. A poll less demanded for Lord L,Frollt., at the eneetkg harwg passed a rote of thaLks tk, the lkla,,or, l.rdse Lord Laseelli has redgeedad tie Lib ;al randi.lol,, arc thereby elected. This ...",1,"7","CIIIPPENIIAII ELECTION.7WEDNEsper,","xgboost_description"
27424,"https://www.britishnewspaperarchive.co.uk/viewer/download/bl/0002214/18470802/056/0004","Cheltenham Journal and Gloucestershire Fashionable Weekly Gazette","... that I threw out the bill that would throw into the hands of the rate-payers the power of electing the commissioners. But how did It propose to throw the election of the col:minim:ors into the hands of the rate-payers? Why, every men was not to have a ...",1,"7","CHELTENHAM BOROUGH ELECTION","xgboost_description"
27431,"https://www.britishnewspaperarchive.co.uk/viewer/download/bl/0000237/18470806/022/0004","Stamford Mercury","... through the election, and the Reformers have only valued their own rights more than him: they have only asserted tbat they would not tricked by degrading union. He therefore not been punished by them, but the persons who placed bis election upon chances ...",1,"7","Lincoln City Election. The numbers declared by Sheriff at o'clock on Thursday afternoon were, for Col. ..","xgboost_description"
27444,"https://www.britishnewspaperarchive.co.uk/viewer/download/bl/0000183/18470802/033/0003","London Evening Standard","... interest would receive from him, it elected, his assistance for the furtherance of its just object. The Mayor, after some hesitation on the first show of hands, put the question a second time, and declared Mr. Mac Gregor elected. A poll was demanded on behalf ...",1,"7","GENERAL ELECTION","xgboost_description"
27474,"https://www.britishnewspaperarchive.co.uk/viewer/download/bl/0000230/18470807/009/0002","Hampshire Chronicle","... loads of stones, which were discharged under the outside private mark. bUfe.Aorry TtUgraph. GENERAL ELECTION RETURNS. 00 Oxford University.This election terminated on fiernoon, after precede Died coni e*. and lar*er nuuibt r the member# havine l>oHed ...",1,"2","LONDON GAZETTE OF TUESDAY","xgboost_description"
27486,"https://www.britishnewspaperarchive.co.uk/viewer/download/bl/0001652/18470805/008/0002","Globe","... withdrawn from the contest. Liverpool Election. We find that it was not Mr. Todd Naylor, but Mr. R. C. Naylor, who proposed Lord John Manners, at the nomination on the 28th of July. Errors to Knaresrorouoh Election ik the Daily Tapi rs. We have been requested ...",1,"7","THE GLOBE, THURSDAY, AUGUST 5, 1847","xgboost_description"
27492,"https://www.britishnewspaperarchive.co.uk/viewer/download/bl/0000206/18470814/011/0003","Manchester Courier and Lancashire General Advertiser","... it. Scotch Gazette. The Bank and thi Elections.lt was certainly very kind of the Bank, and kinder still of the market which allowed the Bank, to defer its startling rise in the rate of discount till the elections were pretty well decided. Had the Bank ...",1,"7","General Intelligence","xgboost_description"
27499,"https://www.britishnewspaperarchive.co.uk/viewer/download/bl/0000183/18470810/021/0003","London Evening Standard","... MR. COWAN'S INELIGIBILITY TO SIT IN PARLIAMENT. A question of great importance has arisen with regard to the election of Mr. Charles Cowan, which is now the subject of much discussion. It is stated that the hon. member holds, as a partner of the Messrs ...",1,"7","MR. COWAN'S INELIGIBILITY TO SIT IN.PARLIAMENT","xgboost_description"
27507,"https://www.britishnewspaperarchive.co.uk/viewer/download/bl/0000065/18470813/017/0005","Hull Packet","... Item,-Gratusity to nailer for holding s. horse wislel being elected member ndfor Grimsby. 0 0 2 se.r ne Total cost of a seat in Parliament .. 1 2 Mo-fm.-Not to give anything Loto ?? next election. ?? understand the workmen at the Grimsby New Dock have on ...",1,"7","LOCAL & GENERAL NEWS","xgboost_description"
27520,"https://www.britishnewspaperarchive.co.uk/viewer/download/bl/0000488/18470814/026/0004","Lancaster Gazette","... can impose an effective check, it has been suggested this morning that Par- liament should be assembled as soon as the elections are concluded, in order that the whole subject should be reconsidered not with a view to impose any per- manent impediment ...",1,"7","GENERAL INTELLIGENCE","xgboost_description"
27600,"https://www.britishnewspaperarchive.co.uk/viewer/download/bl/0001652/18470820/017/0003","Globe","... 96  814 - 473  261  159  893 - 294  41  399 - 200  11l  63  374 I THE GENERAL ELECTION. WEST SOMERSET ELECTION. Tauxto*. Thursday.--This day, about noon,tte High Sheriff made his retun, and a&nonnoed; the final doU bo as ...",1,"7","THIS JAMAICA MARKETS","xgboost_description"
27609,"https://www.britishnewspaperarchive.co.uk/viewer/download/bl/0000083/18470731/012/0005","Manchester Times","... the opportunity a temporary lull in the excitement of this day's election proceedings, to send you this tirst part of my despatch. The concurrence of the London and Westminster elections one and the same day, has brought into the field the whole political ...",1,"7","Local Intelligence","xgboost_description"
27616,"https://www.britishnewspaperarchive.co.uk/viewer/download/bl/0001652/18470803/014/0002","Globe","... E.The election of two members of Parliament for the Northern division of this county announced take place at Coleshill on the 10th inst.; and the election for two members for the Southern division at Warwick on the following day. The election for two ...",1,"7","THE GLOBE, TUESDAY, AUGUST 8, 1847","xgboost_description"
27619,"https://www.britishnewspaperarchive.co.uk/viewer/download/bl/0000612/18470820/016/0002","Durham County Advertiser","... General. In such case new election for this city would necessary. .Mr. Wawn, the member for South Shields, will walk into the House of Commons without paying single farthing for his return ; his constituents having borne all his election expeuces, and preseuted ...",1,"7","FRANCE","xgboost_description"
27680,"https://www.britishnewspaperarchive.co.uk/viewer/download/bl/0001316/18470816/004/0001","Evening Mail","... erent, year Mato b*  »a. The panic about diteaae in the tkiiiuj l *' ' ** end, and certainly the plant never THE GENERAL ELECTION. DDMBABTONSHIRE. Acoon 12. b eonmimicatloa of Hitsrdar I staM that then a'nwMnl STpeetaMa that Mr. ItoborUoa wools not persist ...",1,"7","EAWR or XSO LAND","xgboost_description"
27693,"https://www.britishnewspaperarchive.co.uk/viewer/download/bl/0001272/18470821/021/0002","Monmouthshire Beacon","... members of this county. These were a sort of wind up to the agitation which had preceded. The excitement of the contested election, which has for the last few weeks agitated this town, in common with others throughout the country, has now subsided ; and ...",1,"7","iiocal JhitcUignuc","xgboost_description"
27720,"https://www.britishnewspaperarchive.co.uk/viewer/download/bl/0000874/18470807/011/0003","Weekly Vindicator","... other provinces, where it will form an accompaniment to the heart-thrilling words Ireland fur the IrishRepeal, BELFAST ELECTION-NOMINATION OF CANDIDATES. Twelve oclock, on Thursday, being the hour ap. pointed for the nomination ol candidates for this ...",1,"7","perfectly instructed in the nature of their claims on the soil of their native land. Thanks to the immortal ..","xgboost_description"
27727,"https://www.britishnewspaperarchive.co.uk/viewer/download/bl/0001279/18470813/044/0003","Hull Advertiser and Exchange Gazette","... plaintiff failing bis proof, a verdict passed forfdefendant. A Dead Mans Vote. -One remarkable feature of the late stirring election for the representation of the . University is, that (fuondam voter, whose letter had been , returned the committee, and who ...",1,"2","A correspondent of the Agricultural Gazette «ay*. that common road-duct. «prink led the turnip plant, is euro ..","xgboost_description"
27776,"https://www.britishnewspaperarchive.co.uk/viewer/download/bl/0000369/18470828/065/0004","Reading Mercury","... surrcuder. ridiculed the idea of being placed in the election return as a feather in the cap of Whiggery. The present constitution of the House of Commons was such as to cause no doubt but that another election would shortly take place. Then the Whigs would ...",1,"7","MISCELLANEOUS. Death Gbnbral Sir G. Cockburn. The death of this veteran officer and politician took place at ..","xgboost_description"
27931,"https://www.britishnewspaperarchive.co.uk/viewer/download/bl/0000361/18470828/020/0004","Salisbury and Winchester Journal","... with sufficient prompt-1 ness during the election proceedings here. The majority of the inhabitants are not favourable to this force, and justly complain of the want of protection during those , days of rioting. They would have felt more satisfied if an ...",1,"7","Winchester","xgboost_description"
27937,"https://www.britishnewspaperarchive.co.uk/viewer/download/bl/0000051/18470731/021/0004","London Daily News","... were delayed by a press of business at Exeter, and their lordships did not arrive in this town until after the close of the election, when the excitement which had prevailed throughout the day was beirinning to subside. The business of the assize is likely ...",1,"7","ASSIZE INTELLIGENCE","xgboost_description"
27996,"https://www.britishnewspaperarchive.co.uk/viewer/download/bl/0001287/18470814/014/0002","Belfast Commercial Chronicle","... been the faults which be had been guilty. The indentures were then given np, and the parties left the court. Tkt Belfati Election, Some interest was excited concerning complaint of the deputy-assessors against the Mayor for wages, which ha« been entered ...",1,"7","ANNUAL MEETING Off THE BOTAL","xgboost_description"
127797,"https://www.britishnewspaperarchive.co.uk/viewer/download/bl/0000249/18470807/009/0002","Leamington Spa Courier","... about three ago, a   from the up country landed about si* sacks of flour in Newport, which were stored up.'jtf*' Cattle Market. The price obtainable since tbat perio tli* at one time about 80s. per sack, which was refused. * f»   wanted from 84s ...",1,"","The Evil or Kerping Corn too Long.We have been informed, on good authority, that about three ago, a party from","xgboost_description"
127970,"https://www.britishnewspaperarchive.co.uk/viewer/download/bl/0000193/18470731/103/0008","Leeds Intelligencer","... some days before Mr. Cheethams   bad employed a band of music and several banner-bearers to go about the town and the out skirts, and these were followed by a motley group of the idle and curious. Mr. Stansfields   remained almost quiescent until ...",1,"","PONTEFRACT BOROUGH ELECTION. The nomination of candidates for this borough took place at the Town Hall, on ..","xgboost_description"
127983,"https://www.britishnewspaperarchive.co.uk/viewer/download/bl/0000352/18470731/020/0004","Hertford Mercury and Reformer","... any  . He had, however, been asked to what   he belongtd ; but   were so mixed at the* present moment that it was difficult for any one to say to what   he belonged; it was difficult to define any   but the Protection ...",1,"","ST. ALBAN'S ELECTION","xgboost_description"
128004,"https://www.britishnewspaperarchive.co.uk/viewer/download/bl/0001669/18470731/080/0004","Norwich Mercury","... need only appeal to their good understanding to ensure order ana an impartial hearing to every   who should address them. (Cheers.) had been a strong   roan in his time, but he had always been ready to demand for every man a fair and impartial hearing ...",1,"","NOMINATION of the CANDIDATES","xgboost_description"
128045,"https://www.britishnewspaperarchive.co.uk/viewer/download/bl/0000336/18470821/018/0005","Leeds Times","... agreed to sink tbe questio vexata upon which they splitâ€”tbe education questionâ€”we were sanguine enough to hope chat each   would tacitly consent to allow by-gones to be bygones, and work together hereafter for the good of the Liberal cause. Not ...",1,"","LOCAL NEWS","xgboost_description"
128068,"https://www.britishnewspaperarchive.co.uk/viewer/download/bl/0000366/18470731/028/0006","Newcastle Guardian and Tyne Mercury","... public house the   stopped, when another body of men, with whom was the prisoner Hamilton, came out of the house, and after some words had passed between the prisoners they stripped and proceeded to fight. As the tight went on,   spirit waxed high ...",1,"","DURHAM MIDSUMMER ASSIZES","xgboost_description"
128073,"https://www.britishnewspaperarchive.co.uk/viewer/download/bl/0000612/18470806/007/0001","Durham County Advertiser","... having alighted, iu a few minutes, accompanied most numerous   his friends and sup- i porters, proceeded to the county courts, whither Mr. Shatio had immediate! v preceded biui. Mr. Sliaftw'a   bad taken up their positiou the bench at the right the ...",1,"","MESSRS. UoWMA.N AND WAT SO V, AUCTIONEERS,","xgboost_description"
128139,"https://www.britishnewspaperarchive.co.uk/viewer/download/bl/0000206/18470828/035/0007","Manchester Courier and Lancashire General Advertiser","... defendants had been partnership in the cotton trade with Mr. James Taylor, who was one of the   to the effecting the loan. In December last the   applied for two loans of 10/. each, one for tho firm, and the ether also for the farm, but to ...",1,"","News of the Neighbouring Towns","xgboost_description"
128166,"https://www.britishnewspaperarchive.co.uk/viewer/download/bl/0001100/18470820/062/0008","Nottingham Review and General Advertiser for the Midland Counties","... punch were also allowed in sufficient quantity to avoid excess. Music was likewise engaged for a merry dance, and some of the  , although numbering the years of three score and ten, kept up the festivity and rejoicing with much spirit until the setting ...",1,"","NOTTINGHAM REVIEW","xgboost_description"
128206,"https://www.britishnewspaperarchive.co.uk/viewer/download/bl/0000950/18470817/059/0003","Cumberland Pacquet, and Ware's Whitehaven Advertiser","... accounts will prove very unfavourable, and that many smaller  , especially among the Irish houses, will lie pulled down. About *lOO,OOO are alleged to be the liabilities of the   at Stockton, with regard to whom it has been asserted that a ...",1,"","WEST CrMBERLANO ELECTION","xgboost_description"
128230,"https://www.britishnewspaperarchive.co.uk/viewer/download/bl/0000361/18470731/012/0003","Salisbury and Winchester Journal","... with truth, that, with regard to   politics, every thing was in abeyance. There was no great national   yet formed. There were, it was true, the Government  , the Peel  , and the Lord George Bentinck  . He was afraid Lord ...",1,"","SALISBURY ELECTION","xgboost_description"
128249,"https://www.britishnewspaperarchive.co.uk/viewer/download/bl/0000350/18470811/042/0007","Worcestershire Chronicle","... counties or boroughs there is such a unanimity of feeling, such a unanimity of principles put forward by all  , that we might hire one   to conduct them for us both, to the great saving of expense. (Cheers and laughter.) I can only say that, however ...",1,"","EAST WORCESTERSHIRE ELECTION","xgboost_description"
128251,"https://www.britishnewspaperarchive.co.uk/viewer/download/bl/0000354/18470730/038/0006","Lincolnshire Chronicle","... light a light for them, one of the   cried out, ' Hit her, and don't let her.' They then dragged brother out of the room. I went to save him, and asked them for the love and honour of God not to kill my brother. The   said, ' Bring him out,' When they ...",1,"","Sunday to Thursday's Post","xgboost_description"
128302,"https://www.britishnewspaperarchive.co.uk/viewer/download/bl/0000938/18470819/039/0004","Brighton Gazette","... n and re-combination of   ; nor are we, perhaps, disposed to dispute the accuracy of this position. But where, ask, are the elements of such recombination to be found, if he who has already broken the Conservative   into sections, continues ...",1,"","BRIGHTON GAZETTETHURSDAY, AUGUST 19, 1847","xgboost_description"
128323,"https://www.britishnewspaperarchive.co.uk/viewer/download/bl/0000099/18470814/031/0007","Preston Chronicle","... months ago, a   frem.tho up country landed about six hun- dred sacks of flour in Newport, which were stored up in the cattle market. The price obtainable since that period was at one time about 80s. per sack, which was refused, as the   wanted from ...",1,"","MISCELLANOEUS NEWS","xgboost_description"
128404,"https://www.britishnewspaperarchive.co.uk/viewer/download/bl/0000298/18470731/003/0002","Leicestershire Mercury","... connected with the Nomination. Each   mustered numerously on the bust ings, and the supporters of each ranged themselves opposite their respective representatives on the platform. 1 he ranks of the Liberal   had a decided preponderance number and ...",1,"","THE NOMINATION OF THE CANDIDATES","xgboost_description"
128452,"https://www.britishnewspaperarchive.co.uk/viewer/download/bl/0000398/18470818/003/0002","Hereford Journal","... after this a row was very readily got up between a   of agricultural labours coming from the Beaufort Arms, and the navigators and others round the hustings, favourable to Lord Granville's  , when a rush was made towards the town-gate, followed ...",1,"","THE ELECTIONS","xgboost_description"
128458,"https://www.britishnewspaperarchive.co.uk/viewer/download/bl/0002212/18470825/032/0002","Cheltenham Examiner","... Serie eine the appendatent, has may year r Sarmatian Apr it the Literal  . We her met yet bred de is.. of re earner. W. is remained barite dr dation of the the Cameartive  . TIM 1.101 use PAWNS RITES. I Tbe Conditioners hold a weld waft psitorasy ...",1,"","CIiSLTENHAN STAG HOUNDS","xgboost_description"
128522,"https://www.britishnewspaperarchive.co.uk/viewer/download/bl/0000083/18470807/039/0012","Manchester Times","... was injured. The whole was the work an instant, and, it quite unnecessary to say, arose without orders from myself or other  , and entirely out of the confusion created the breaking of the barrier, and the consequent the people upon the police, which ...",1,"","MANCHESTER TOWN COUNCIL MEETING","xgboost_description"
128624,"https://www.britishnewspaperarchive.co.uk/viewer/download/bl/0001427/18470728/032/0004","Morning Advertiser","... public-house and take the   out. The regulations of the police force prohibited police-constables from entering public-houses to suppress brawls. The landlord was master of his own bouse, and he was told, to eject the   fighting. The policeman ...",1,"","DOGGETT'S COAT AND BADGE","xgboost_description"
128803,"https://www.britishnewspaperarchive.co.uk/viewer/download/bl/0000051/18470828/008/0003","London Daily News","... that that document had originated with him (Mr. Winch) or his  , but he rather thought Mr. Talbot's   knew more about it than his. In fact, he believed it have emanated from that  . A discussion then arose as to which amendment should be put ...",1,"","THE ANTI-SANITARIANS OF ST. ANDREWS, HOLBORN","xgboost_description"
128856,"https://www.britishnewspaperarchive.co.uk/viewer/download/bl/0000992/18470814/043/0003","Oxford University and City Herald","... constituency, and yet has been successful; has been the case with many others the course of the recent elections. The several  , nccordinjr to the list given in the of yesterday, have succeeded in securing the following seats respectively. Liberals, ...",1,"","OXFORD UNIVERSITY, CITY, AND COUNTY HERALD, SATURDAY, AUGUST 14, 1847","xgboost_description"
128862,"https://www.britishnewspaperarchive.co.uk/viewer/download/bl/0001653/18470806/054/0006","Durham Chronicle","... power it you change your opinion for the purpose maintaining llie interests of   against the interests of the whole community if, through the change opinion, vou gain   strength, and confirm yourself in powersuch change of opinion ought to bring ...",1,"","~ a AAA.insfinn an Wadneidav i Is that a harvest when corn is at 90* or 100 s a -","xgboost_description"
128945,"https://www.britishnewspaperarchive.co.uk/viewer/download/bl/0002212/18470804/032/0002","Cheltenham Examiner","... record the pod Meng which prevailed throughout. the mental   weeded ink way home to the game order in which Way had arrived. The blue made a detour through the unapt thansghlares t but neap   repaired Weight their Onenlittee4ooo. tee the Othe evening ...",1,"","CHELTENHAM ELECTION DOINGS","xgboost_description"
128972,"https://www.britishnewspaperarchive.co.uk/viewer/download/bl/0001100/18470820/019/0002","Nottingham Review and General Advertiser for the Midland Counties","... Bankrupt. hare received nothing. Mr. Wakefield. Then these   still owe you either money or scrip f The Bankrupt. I consider they do. Mr. Wakefield. Now did you not join these   or some of them, in a speculation in the Nottingham and M ...",1,"","hearted, allowance making society ! Thou eanst wink quite piously a score of meannesses, and hug rascality and ..","xgboost_description"
129141,"https://www.britishnewspaperarchive.co.uk/viewer/download/bl/0000083/18470814/027/0008","Manchester Times","... New Blown -street, as occupiers of the warehouses and offlces, were as follow (but will lie seen below, one or two of these   had either ceased to hotd the premises, or had stocks in them to little amount as ll'* to need particular mention):So. 2 ...",1,"","GREAT DESTRUCTION OF PROPERTY BY FIRE IN MARKET-STREET","xgboost_description"
129228,"https://www.britishnewspaperarchive.co.uk/viewer/download/bl/0000099/18470821/028/0007","Preston Chronicle","... punch were also allowed in sufficient quantity to avoid excess. Music was likewise engaged for a merry dance, and some of the  , although numbering the years of three score and ten, kept up the festivity with much spirit until the setting sun closed the ...",1,"","MISCELLANEOUS NEWS","xgboost_description"
129236,"https://www.britishnewspaperarchive.co.uk/viewer/download/bl/0000981/18470821/049/0004","Bristol Times and Mirror","... for seven days the   were shut in. till the cow was declared cut up. and the claret on the stoop, when the last gallon was mulled with spices, and drank in tumblers to their next merry meeting. Ihe same writer describes a   given unfinished room ...",1,"","BRISTOL TIMES,","xgboost_description"
129320,"https://www.britishnewspaperarchive.co.uk/viewer/download/bl/0000336/18470731/030/0005","Leeds Times","... adduce the case of two men, one from each of the leading   of the state. Now lam K oin B t0 refer t0 tee opinion of a still more eminent man ; a man of whom in his presence during the heat of   conflicts I never said one word of disrespect, and with ...",1,"","TAMWORTH","xgboost_description"
