"id","url","publication_title","description","status","g_status","title","status_writer"
132501,"https://www.britishnewspaperarchive.co.uk/viewer/download/bl/0000612/18470730/020/0001","Durham County Advertiser","... Hearts Oak public-house the   stopped, when another body of men, wiib whom tue prisoner Hamilton, came out of the house, aud alter some words had passed between the stripped aud proceeded to tight. As the tight on,   spirit waxed high, aud time ...",1,"","Gentlemen,The calendar which your attention will be directed the present occasion is, I believe, not very ..","xgboost_description"
132712,"https://www.britishnewspaperarchive.co.uk/viewer/download/bl/0001100/18470827/045/0006","Nottingham Review and General Advertiser for the Midland Counties","... yesterday morning; and prisoner having agreed to barter his own new shirt for the old one another man and 2s. to boot, the   proceeded to strip in the White Horse taproom ; but the other man ran off with Plants shirt on his back, not remembering ...",1,"","LEICESTER l\ LOUGHBOROUGH,","xgboost_description"
132743,"https://www.britishnewspaperarchive.co.uk/viewer/download/bl/0000298/18470828/024/0003","Leicestershire Mercury","... one of them heard a cry of distress, running to the well, could just see the little fellow's hair and face. Another of the   got ladler from the bain, and rescued him from his perilous situation unhurt. Extensive Fire/ At Brougbton Astlev fire broke ...",1,"","LUTTERWORTH","xgboost_description"
132761,"https://www.britishnewspaperarchive.co.uk/viewer/download/bl/0000237/18470820/008/0002","Stamford Mercury","... determination to visit Uke offences with the utmost severity. Brigg Magistrates' Meeting, August 3 and 17. Aug. Several   were fined for riding upon shaft*, and one or two minor assaults were speedily disposed of; but the following adjourned assault ...",1,"","On Tuesday last, the City Magistrates remanded for further examination Thos. Sharpe, charged with stealing pair ..","xgboost_description"
132769,"https://www.britishnewspaperarchive.co.uk/viewer/download/bl/0000393/18470828/032/0004","Gloucestershire Chronicle","... stern sheets two females in mourning. .  V- ' .. which, shooting a-head, lauded the   a few minutes before Mi«s Cannon and her pupils, and the   walked slowly a few paces. coming up to them. Miss Charlotte Curtis recognise*l her mother ...",1,"","CHIT-CHAT","xgboost_description"
132815,"https://www.britishnewspaperarchive.co.uk/viewer/download/bl/0001097/18470810/051/0006","South Eastern Gazette","... prisoners Fletcher and Newport were taken alter a sharp run, during which Fletcher arossed the river Mole. Wood, one of the  , was seized, but he pulled a small crowbar from his coat, and struck the man who seized him across the arm. Mr. Locke conducted ...",1,"","GRAVESEND","xgboost_description"
132830,"https://www.britishnewspaperarchive.co.uk/viewer/download/bl/0000398/18470804/013/0003","Hereford Journal","... months ago,   from the up-country landed about six hundred sacks of flour in Newport, which were stored up in the Cattle Market. The price obtainable since that period, was at one time about «fi PCr SaCk ' , was refused, as the   wanted from 84* ...",1,"","HEREFORD CITY REPRESENTATION","xgboost_description"
132836,"https://www.britishnewspaperarchive.co.uk/viewer/download/bl/0001427/18470827/037/0004","Morning Advertiser","... where would be comm'The prisoner'sJd, indifferently, then I had better not I was''then fully committed for trial, and the   weie bound over to prosecute. WESTMINSTER. Joseph Saunders, a cab proprietor, produced one of his men. to answer the charge ...",1,"","CLERKENWELL","xgboost_description"
132925,"https://www.britishnewspaperarchive.co.uk/viewer/download/bl/0000237/18470820/005/0002","Stamford Mercury","... Club of the Jacobins, intimating, the same time, that such a connexion must expose it the exmtion the whole institutional  . maladroit allusion has unaartbed a certain journal kept the then Duke Cnartre*, now King of the from month of November mi ...",1,"","Wednesday & Thursday's Posts","xgboost_description"
132937,"https://www.britishnewspaperarchive.co.uk/viewer/download/bl/0000311/18470819/006/0002","Cheltenham Chronicle","... . order to understand the nature of the proceedings, it may necessary to allude to the law of marriages in ibis country.   can be married by clergyman of the Established Church, either by license from the proper officer of the bishop, or by having ...",1,"","MISCELLANEOUS NEWS","xgboost_description"
132977,"https://www.britishnewspaperarchive.co.uk/viewer/download/bl/0000251/18470821/074/0006","Staffordshire Advertiser","... famine being removed, the j public at once question the necessity of making any provision for such a contingency ; and the   who are sufferers by the fall in prices are blamed for their want of foresight. may, however, be remarked, that the belief ...",1,"","THE IRON TRADE","xgboost_description"
133003,"https://www.britishnewspaperarchive.co.uk/viewer/download/bl/0001652/18470806/048/0004","Globe","... which is entitled, Act for extending the provisions of the law respecting threatening letters, and accusing   with view to extort money.   sending letters threatening to kill or murder are be deemed guilty of felony, and upon conviction are liable ...",1,"","POLICE","xgboost_description"
133038,"https://www.britishnewspaperarchive.co.uk/viewer/download/bl/0000230/18470807/025/0004","Hampshire Chronicle","... present prices of the run modify, could not fail to be senoualy uncovered It Mated. aUo. that they have been left in default   for whom they bad exenitecl large purchase orders commission The more immediate cause of stoppage was said to the failure ...",1,"","KX\ K KI PT","xgboost_description"
133169,"https://www.britishnewspaperarchive.co.uk/viewer/download/bl/0001316/18470827/039/0008","Evening Mail","... offering his influence to several  ; and if he have bargained for it with France, he will doubt have sold it to the best bidder. Narvaez may have returned with undiminished resolution, andif go with the French  may give striking proofs of his ...",1,"","EVENING MAIL, PROM WEDNESDAY, AUGUST 85. TO FRIDAY, AUGUST 87. 1847","xgboost_description"
133191,"https://www.britishnewspaperarchive.co.uk/viewer/download/bl/0000354/18470806/016/0005","Lincolnshire Chronicle","... complete peal upon six bells, within an hour, including the raise nnd fall. The prize for the peal was awarded to the Withain  , and for the rise fall to the Clinton men. The ringing of the changes was nearly alike, excepting that the Witham company was ...",1,"","Stamford Town Council. The u meeting of this body was held in the Town-hall on Tuesd present: the Mayor, Messrs","xgboost_description"
133224,"https://www.britishnewspaperarchive.co.uk/viewer/download/bl/0000358/18470821/036/0004","Berkshire Chronicle","... were driving a chaise in the neighbourhood of Highgate, a flash of lightning struck the horse and killed him instantly. The   were thrown from the chaise, but luckily escaped unhurt. The editor of an American paper, the Charleston Evening News, says ...",1,"","LONDON MARKETS","xgboost_description"
133253,"https://www.britishnewspaperarchive.co.uk/viewer/download/bl/0001272/18470821/010/0001","Monmouthshire Beacon","... (cheers). should have been very much ashamed tt.e mixture of principles principle all, which composed the other side. It was a   jumbled up together for the purpose overturning the Conservative interest of this county which had been united for upwards ...",1,"","THROUGHOUT THE DIOCESE","xgboost_description"
133387,"https://www.britishnewspaperarchive.co.uk/viewer/download/bl/0000361/18470821/035/0004","Salisbury and Winchester Journal","... eapi tal will realise the   embarking 2080 amount of income 251. capital will, or i*yee 200,000/. per annum. Full particulars will hAnrwarded per return post, which must prove satisfactory to all intelligent  . It does not matter how high ...",1,"","TO THE NOBILITY, GENTRY, & YEOMANRY, THE ELECTORS OP NORTH WILTS. Gentlemen, HAVING been apprised letters from ..","xgboost_description"
133648,"https://www.britishnewspaperarchive.co.uk/viewer/download/bl/0001427/18470731/073/0003","Morning Advertiser","... sudden and unexpected result of this election has created the ntmost astonishment in the minds of all classes and of all  . The town, after the close of the poll, was a scene of the most excited and extraordinary character. The whole population ...",1,"","NOTTINGHAM,","xgboost_description"
133675,"https://www.britishnewspaperarchive.co.uk/viewer/download/bl/0001316/18470730/040/0007","Evening Mail","... Alfred Hervey, takes place today. Captain Pechell* seat is regarded as secure all  , and the struggle will be between Lord Alfred Hervey and Mr. Conyngham. Both   speak confidently cf success. ...",1,"","BRADFORD","xgboost_description"
133716,"https://www.britishnewspaperarchive.co.uk/viewer/download/bl/0001372/18470803/008/0001","Armagh Guardian","... place. from the evidence brought forward in this case, it appeared that land on which the riot took place, was claimed both  , and that the prosecutor had gone, the day ques. lion, lake possession and drive the prisoners out, who were that time the ...",1,"","COUNTY AKMAGII ASSIZES","xgboost_description"
133969,"https://www.britishnewspaperarchive.co.uk/viewer/download/bl/0000914/18470828/028/0003","Cardiff and Merthyr Guardian, Glamorgan, Monmouth, and Brecon Gazette","... coioursofthe Liberal   which were liist brought in by Sir B. Hall, in the great contest for the boroughs in 1831, when he defeated the Marquis of Worcester. The mixture was completely emblematic of this union of both   on this occasion, in favour ...",1,"","MONMOUTHSHIRE","xgboost_description"
133992,"https://www.britishnewspaperarchive.co.uk/viewer/download/bl/0001144/18470813/012/0002","Tyrone Constitution","... candidate, in opposition to Mr. John OConnell, Mr. Ricb&rd OGorman, jun., of spouting notoriety os member of Young Ireland  . The worthy priest was rather roughly handled, and threatened with serious personal violence the mob, who | declared that they ...",1,"","THE TYRONE CONSTITUTION, OMAGH, FRIDAY. AUGUST 13. 1817. ELECTION RESULTS","xgboost_description"
134062,"https://www.britishnewspaperarchive.co.uk/viewer/download/bl/0000174/18470805/028/0007","Morning Post","... purchased different articles of furniture from him to the amount of 1082. What the pre- cise nature of the agreement between the   was, and whether the transaction was to be a ready money one, or upon credit, did not clearly appear ; but in the result the ...",1,"","ASSIZE INTELLIGENCE","xgboost_description"
134189,"https://www.britishnewspaperarchive.co.uk/viewer/download/bl/0000251/18470807/124/0006","Staffordshire Advertiser","... voters, and Lord Fielding's   came up in superior strength. At a few minutes after eleven the majority of Mr. Goulburn wos reduced to 12, but below this it never went At twelve or one o'clock, it was evident that both   were polled out, with the ...",1,"","E DIN BU RGH.FRI DAY","xgboost_description"
134469,"https://www.britishnewspaperarchive.co.uk/viewer/download/bl/0000034/18470821/034/0008","Bristol Mercury","... wack he had followed hins with that intention, and was some- what exasperated at his refusal lie denred striking the ether  ; lie was tipsy at hse time. Thuaeingistrsues said that iexcuse did not acquit him of the assault; if the prisoner was a deserter ...",1,"","POLICE INTELLIGENCE","xgboost_description"
134572,"https://www.britishnewspaperarchive.co.uk/viewer/download/bl/0001316/18470806/036/0006","Evening Mail","... not by tbs number of rotes in his favour, but the number of cacatdrpi, or bludgeon-men, in his pay, or rather in that of his  . All Administrations, Cabraiistaaer Liberals, hare resorted Is the tame meant; and the leaders of these bands of tafflisi are ...",1,"","TBS AFFAIRS OP PORTUGAL","xgboost_description"
135196,"https://www.britishnewspaperarchive.co.uk/viewer/download/bl/0000928/18470731/031/0003","Monmouthshire Merlin","... months ago, a   from the up country landed about six hundred sacks of flour in Newport, which were stored up in the Cattle Market. The price obtainable since that period, was at one time about 80s. per sack, which was refused, as the   wanted from ...",1,"","NEWPORT CATTLE MARKET.WEDNESDAY, JULY 28","xgboost_description"
135221,"https://www.britishnewspaperarchive.co.uk/viewer/download/bl/0000395/18470807/053/0004","Derbyshire Courier","... order of merit. The decoration of the new order will bear one side the effigy of the founder, and on the other the name of the   receiving it. The Jenny Lind mania has had some odd manil unions. In the window of an inn near St. Martin' Court an announcement ...",1,"","Ctnr SLJtfctUn (Tomprntmim","xgboost_description"
135338,"https://www.britishnewspaperarchive.co.uk/viewer/download/bl/0001427/18470804/078/0004","Morning Advertiser","... three months ago a   from the landed about six hundred sacks of flour in Newport, which were stored up in the Cattle-market. The price obtainable since that period was at one time about 80s. per sack, which was refused, as the   wanted from 84s. ...",1,"","SHIPPING INTELLIGENCE,","xgboost_description"
135371,"https://www.britishnewspaperarchive.co.uk/viewer/download/bl/0001652/18470803/026/0003","Globe","... three months ago,   from the up countrylanded about si* hundred sacks of Boar in Newport, which were stored up the Cettle Market. The price obtainable since that period was at one time about 80s. per sack, which was refused, as the   wanted from 84s ...",1,"","COMMERCIAL MARKETS","xgboost_description"
135382,"https://www.britishnewspaperarchive.co.uk/viewer/download/bl/0001083/18470806/040/0004","Derbyshire Advertiser and Journal","... were covered with them, and in many places whole fields appeared as if they had been dusted with soot. A Pleasure  . With a Hook!   of friends left Hull the other day by a cheap train for an excursion into the country. In order do the thing economically ...",1,"","A jiarty of labourers were going over a hill at Alciston, on Saturday week, while a storm was raging; the","xgboost_description"
135400,"https://www.britishnewspaperarchive.co.uk/viewer/download/bl/0000396/18470821/015/0003","Hereford Times","... en route for Santa Fe. The emigrants and military   to California, especially the Mormons, have suffered much on the prairies, not only the Indians, but from sickness and famine One emigrant   having been diminished more than onehalf starvation ...",1,"","FOREIGN INTELLIGENCE","xgboost_description"
135432,"https://www.britishnewspaperarchive.co.uk/viewer/download/bl/0001097/18470817/037/0005","South Eastern Gazette","... enquiry at Sir J. Herscbells, no such person it was found bad been there. Every step was taken to ascertain the route the   had gone, but without success, till next day, when Mr. Yates, of the Royal Oak Inn, Hastings, sent his man home with it, he ...",1,"","CRICKET. Pbnbnden Heath r. Mote Park.This match was played on thegronndof the former club on Thursday. Mote ..","xgboost_description"
135456,"https://www.britishnewspaperarchive.co.uk/viewer/download/bl/0000401/18470813/042/0003","Shrewsbury Chronicle","... staled that the whole line from Shrewsbury to Stafford, including the Station Shrewsbury, contracted for highly raap ctabla  , be completed bv the j aa«i yaar, end for sum under the Farlu* j eatimale. SttirPNALL Perry Session* were helJ on Fnd*y. belareW ...",1,"","Hr. Viilitff has been retn reed for Sonlh Lancashire, but no lias followed n« whether the hon. eehtleraan will sit","xgboost_description"
135619,"https://www.britishnewspaperarchive.co.uk/viewer/download/bl/0000252/18470807/084/0007","Staffordshire Advertiser","... gave to the Conservatives a majority of 91which majority was subsequently raised to 100. The disruption of the Conservative   afforded the Whigs some few accessions; but still the majority remained with their opponents, to the extent of 80 or 90 votes ...",1,"","[From the Morning Herald,]","xgboost_description"
135718,"https://www.britishnewspaperarchive.co.uk/viewer/download/bl/0000298/18470828/021/0003","Leicestershire Mercury","... House of Correction. The Castle Donington constable appeared before the Bench with a summons for an assault, and sai the   in his absence called last evening and left three shillings, an 1 wished to have made up. (the constable) had told them they ...",1,"","LOUGHBOROUGH","xgboost_description"
135807,"https://www.britishnewspaperarchive.co.uk/viewer/download/bl/0000532/18470828/011/0002","Gloucester Journal","... the second resolution, laying down the principle that it was the duty of the government to legislate for the good of all   in the state, and giving every access to the occupancy of the land ; and that, therefore, the subject of home colonization ...",1,"","MISCELLANEOUS INTELLIGENCE. The Indian Seas.The effects of our policy in the  Kastem Archipelago are rapidly ..","xgboost_description"
135919,"https://www.britishnewspaperarchive.co.uk/viewer/download/bl/0001523/18470805/022/0002","Banbury Guardian","... University he is a Member. The  , which was a large one, remained until late hour, and the dance and song went merrily round. This arrangement was a very judicious oneit kept the streets free from contending  , and tended to preserve the peace ...",1,"","THE CHAIRING","xgboost_description"
135936,"https://www.britishnewspaperarchive.co.uk/viewer/download/bl/0000081/18470803/028/0004","Liverpool Mercury","... and noiden, he prisoners were committed for trial. Consumption op Smoke.On Saturday, the hearing of informations against   for not consuming their smoke, in conformity with the provisions of the Sanatory Act, was again proceeded with. The two cases ...",1,"","Police Court","xgboost_description"
135937,"https://www.britishnewspaperarchive.co.uk/viewer/download/bl/0000822/18470729/003/0001","Enniskillen Chronicle and Erne Packet","... them fall on hup. the 1,,T ~ . . . . following is the portion of his testimony, relative the atcly shot dead by one of the  . Ihe Jury were tendering unlawful oath. .One assailants discharged ten o'clock at n:ghl, net having agreed took out a book ...",1,"","ENNISKILLEN, THURSDAY, JULY 40, 1847","xgboost_description"
135944,"https://www.britishnewspaperarchive.co.uk/viewer/download/bl/0000206/18470731/016/0004","Manchester Courier and Lancashire General Advertiser","... EUesmere and family, Viscount Bracklj, Gen. Sir Thos. Arbuthnot and his Aide-dc- Camp, Capt. Vane, besides a numerous fashionable  . The band of the Lancashire Yeomanry were also there playing popular music. It being payday, on the spot it was the Earl's ...",1,"","Local Intelligence","xgboost_description"
135948,"https://www.britishnewspaperarchive.co.uk/viewer/download/bl/0001702/18470821/057/0004","Shipping and Mercantile Gazette","... deposed to the receipt of the check, and its being returned; and Mr. C. Spratt, clerk to Messrs. Drummonds, said that no such   as *Thos. Lloyd and Co. banked their house, or had ever done so. Alderman Johnson committed the prisoner for trial. Murderous ...",1,"","POUCB INIELUGENCE","xgboost_description"
135950,"https://www.britishnewspaperarchive.co.uk/viewer/download/bl/0000051/18470821/014/0003","London Daily News","... there were present in the work- above 60 years of age, went to aay referred to the rota consider the best Siding for such   a.liberal scale outpMP* Jrthero'* had met and deliberated upon the in* re«j to incur the responsibility *f»' ~. that hereafter ...",1,"","Lieutenant Munro.Our Windsor correspondent states that, in the hope that Mr. Munro would been acquitted at the ..","xgboost_description"
135973,"https://www.britishnewspaperarchive.co.uk/viewer/download/bl/0000091/18470821/064/0015","Northern Star and Leeds General Advertiser","... are so severely burnt that no hopes are entertaived of their recovery. The boy, Wm. Cresswell, is the i d only one of the   likely to survive. Another accident occurred the same day at about F 100 yards from the asene of the above explosion. The ...",1,"","Home News","xgboost_description"
136089,"https://www.britishnewspaperarchive.co.uk/viewer/download/bl/0000206/18470825/017/0006","Manchester Courier and Lancashire General Advertiser","... much right to the prefix of Dan asjof Don. Morning Chronicle. The Ways and Means the North. The leaders of the  liberal    in the northern division of Northumberland are taking great credit to themselves for originating a subscription to defray the ...",1,"","Lieutenant Munro.It may be mentioned, as one proof of the high estimation in which Lieutenant Munro held by ..","xgboost_description"
136247,"https://www.britishnewspaperarchive.co.uk/viewer/download/bl/0000989/18470814/029/0004","Oxford Chronicle and Reading Gazette","... three months ago.   from the up country landed about 600 sacks of flour in Newport, which was stored up in the Cattle Market. The price obtainable since that period was at one time about 80s. per sack, which was refused, as the   wanted 84s. to 86s ...",1,"","MISCELLANEOUS","xgboost_description"
136321,"https://www.britishnewspaperarchive.co.uk/viewer/download/bl/0001652/18470825/008/0001","Globe","... state of creditable repair. If the application successful, it is hoped that no attempt wul be made to impose any tax upon   visiting the castle. The bounty of the corporation should be bestowed on that express condition. Ancient Relics. The discovery ...",1,"","ITALY","xgboost_description"
136330,"https://www.britishnewspaperarchive.co.uk/viewer/download/bl/0000178/18470806/007/0002","Royal Cornwall Gazette","... get throngh some parts of the Caledonian Cariai.and a small steamers, therefore, preparing for the reception of the Royal   ; bat, excepting tbe pi low and sona of the rngineen, tba offieeis and en- gineers nf tlie Royal yacht will be id command. ...",1,"","BOMBSTZfi","xgboost_description"
136339,"https://www.britishnewspaperarchive.co.uk/viewer/download/bl/0000174/18470803/018/0003","Morning Post","... months ago, a   from the up country landed about six hundred sacks of flour in Newport, which were stored up in the Cattle Market. The price obtainable since that period was at one time about 80s. per sack, which was refused, as the   wanted from ...",1,"","POLICE INTELLIGENCE","xgboost_description"
136394,"https://www.britishnewspaperarchive.co.uk/viewer/download/bl/0000083/18470731/015/0006","Manchester Times","... DISTRICT INTELLIGENCE. ALTRINCHAM.   are very busy in this neighbourhood canvassing for Mr. F. D. P. Astley; also Mr. E. J. Stanley and Mr. Egerton, jointly. Stf.aling Fruit.On Tuesday seven boys, from eight to twelve years of age, were brought ...",1,"","DISTRICT INTELLIGENCE","xgboost_description"
136396,"https://www.britishnewspaperarchive.co.uk/viewer/download/bl/0000950/18470817/067/0004","Cumberland Pacquet, and Ware's Whitehaven Advertiser","... will not act at all. In place of Messrs. Knubley and H. Perry acting scrutineers-satisfying themselves that the several   who came to vole were duly entitled to do so, the servant of the Trustees, and of the electors, out of whose pockets his salary ...",1,"","RETRENCHMENT THE ORDER OF THE DAY","xgboost_description"
136400,"https://www.britishnewspaperarchive.co.uk/viewer/download/bl/0000051/18470826/006/0003","London Daily News","... are occasionally located in London, renders the establishment of a club absolutely necessary, which shall extend to those   the benefits usually derived from such institutions; contemplating the ultimate establishment a library, museum, and model ...",1,"","The Poor St. Pancras Workhouse, and alarming Increase of the Poor-rate.Yesterday special m eting of the vestry ..","xgboost_description"
136404,"https://www.britishnewspaperarchive.co.uk/viewer/download/bl/0002214/18470809/030/0002","Cheltenham Journal and Gloucestershire Fashionable Weekly Gazette","... mach couture sorronst the melancholy event. To. Eva or Boson. n Pod Lotio.-We have in. informed good 'enmity that tbroa ago a   truce the al entottry lauded shoot six bettered of dear in Newport, etas wee. stored up to the Cattle Market The price obtainable ...",1,"","..1.......010.-","xgboost_description"
136436,"https://www.britishnewspaperarchive.co.uk/viewer/download/bl/0000078/18470801/003/0002","Lloyd's Weekly Newspaper","... last, wtth Mr. Weyland, one of the pay-clerks under the Board of Works, and another policeman, when they were fired at by a   of floe men, two of whon were the prisoners, whose object evidently was to rosb Mr. W03 lend of a sum at money which ho was ...",1,"","IRELAND","xgboost_description"
136482,"https://www.britishnewspaperarchive.co.uk/viewer/download/bl/0000498/18470828/029/0006","York Herald","... water. The female prisoner, however, sa:d hat they would have some lemonade, a bottle of which was immediately brought. The   sat in the same room where Mrs. Mason and Mis. Penrose were, tbe two latter of who~, after they lad gone in, went to tbe end ...",1,"","YORK LOCAL NEWS &c","xgboost_description"
136503,"https://www.britishnewspaperarchive.co.uk/viewer/download/bl/0001283/18470828/010/0002","Coleraine Chronicle","... Mr. Drummond, of Albury-park, at his election for West Surrey, will show how tuiile almost it is to class   in the present condition of  . Mr. Drummond said wa& horn a lory, and I stuck to Toryism until became as dead a ...",1,"","THE COLERAINE CHRONICLE. SATURDAY. AUGUST .ML","xgboost_description"
